{
  "authority": {
    "does_not_grant": [
      "astra_core_authority",
      "m1_promotion",
      "v1.0.8_promotion",
      "empirical_validation",
      "peer_review",
      "dark_matter_detection",
      "doi_or_zenodo_authority",
      "scientific_priority"
    ],
    "grants": [
      "exact_dark_medium_response_atlas_v0.1.0_repository_admission",
      "exact_five_asset_namespaced_github_prerelease_admission",
      "exact_versioned_and_namespace_latest_pages_admission"
    ],
    "promotes_v1_0_8": false,
    "supersedes_m1": false,
    "supersedes_s1": false
  },
  "change_roster": {
    "expected_paths": [
      ".github/ISSUE_TEMPLATE/config.yml",
      ".github/workflows/pages.yml",
      ".github/workflows/release-dark-medium-response-atlas.yml",
      ".github/workflows/verify.yml",
      ".gitignore",
      "AGENTS.md",
      "CHANGELOG.md",
      "CONTRIBUTING.md",
      "LICENSE_MAP.md",
      "MANIFEST.sha256",
      "PROVENANCE.md",
      "PUBLICATIONS.md",
      "README.md",
      "RELEASE_NOTES_earth-instrument-wp-0.1.md",
      "REPRODUCING.md",
      "docs/404.html",
      "docs/index.html",
      "docs/resources/index.html",
      "docs/style.css",
      "evidence/README.md",
      "evidence/dark_medium_response_atlas_publication_successor_overlay_s2.json",
      "evidence/dark_medium_response_atlas_successor_overlay_s1.json",
      "evidence/pages_admission_v1.json",
      "resources/README.md",
      "resources/dark-medium-response-atlas/draft-v0.1.0/CHANGE_LOG.md",
      "resources/dark-medium-response-atlas/draft-v0.1.0/DARK_MEDIUM_RESPONSE_ATLAS.md",
      "resources/dark-medium-response-atlas/draft-v0.1.0/LICENSE_MAP.md",
      "resources/dark-medium-response-atlas/draft-v0.1.0/README.md",
      "resources/dark-medium-response-atlas/draft-v0.1.0/claim_ledger.csv",
      "resources/dark-medium-response-atlas/draft-v0.1.0/draft_metadata.json",
      "resources/dark-medium-response-atlas/draft-v0.1.0/novelty_ledger.csv",
      "resources/dark-medium-response-atlas/draft-v0.1.0/source_ledger.csv",
      "resources/dark-medium-response-atlas/v0.1.0/CHANGELOG.md",
      "resources/dark-medium-response-atlas/v0.1.0/CITATION.cff",
      "resources/dark-medium-response-atlas/v0.1.0/LICENSE_MAP.md",
      "resources/dark-medium-response-atlas/v0.1.0/README.md",
      "resources/dark-medium-response-atlas/v0.1.0/RELEASE_NOTES.md",
      "resources/dark-medium-response-atlas/v0.1.0/RELEASE_SPEC.json",
      "resources/dark-medium-response-atlas/v0.1.0/claim-ledger.csv",
      "resources/dark-medium-response-atlas/v0.1.0/dark-medium-response-atlas-v0.1.0.css",
      "resources/dark-medium-response-atlas/v0.1.0/dark-medium-response-atlas-v0.1.0.html",
      "resources/dark-medium-response-atlas/v0.1.0/dark-medium-response-atlas-v0.1.0.md",
      "resources/dark-medium-response-atlas/v0.1.0/dark-medium-response-atlas-v0.1.0.pdf",
      "resources/dark-medium-response-atlas/v0.1.0/external-link-observations.json",
      "resources/dark-medium-response-atlas/v0.1.0/html-accessibility.json",
      "resources/dark-medium-response-atlas/v0.1.0/novelty-ledger.csv",
      "resources/dark-medium-response-atlas/v0.1.0/pdf-inspection.json",
      "resources/dark-medium-response-atlas/v0.1.0/publication-identity.json",
      "resources/dark-medium-response-atlas/v0.1.0/source-ledger.csv",
      "resources/dark-medium-response-atlas/v0.1.0/visual-review.json",
      "schemas/README.md",
      "schemas/dark-medium-response-atlas-html-accessibility-v1.schema.json",
      "schemas/dark-medium-response-atlas-pdf-inspection-v1.schema.json",
      "schemas/dark-medium-response-atlas-publication-identity-v1.schema.json",
      "schemas/dark-medium-response-atlas-publication-successor-overlay-s2.schema.json",
      "schemas/dark-medium-response-atlas-successor-overlay-s1.schema.json",
      "schemas/dark-medium-response-atlas-visual-review-v1.schema.json",
      "schemas/external-link-observations-v1.schema.json",
      "schemas/pages-admission-v1.schema.json",
      "schemas/supplemental-release-identity-v2.schema.json",
      "schemas/supplemental-release-spec-v2.schema.json",
      "tests/conftest.py",
      "tests/test_claim_source_coverage.py",
      "tests/test_dark_medium_response_atlas_documents.py",
      "tests/test_dark_medium_response_atlas_publication_successor_overlay_s2.py",
      "tests/test_dark_medium_response_atlas_release.py",
      "tests/test_dark_medium_response_atlas_successor_overlay.py",
      "tests/test_dark_medium_response_atlas_successor_overlay_historical.py",
      "tests/test_link_audits.py",
      "tests/test_pages_admission.py",
      "tests/test_pages_contract.py",
      "tools/assemble_pages.py",
      "tools/build_dark_medium_response_atlas_documents.py",
      "tools/build_dark_medium_response_atlas_publication_successor_overlay.py",
      "tools/build_dark_medium_response_atlas_successor_overlay.py",
      "tools/build_pages_admission.py",
      "tools/check_dark_medium_response_atlas_html.py",
      "tools/check_external_links.py",
      "tools/check_pages_admission.py",
      "tools/check_pages_links.py",
      "tools/check_repository.py",
      "tools/check_repository_links.py",
      "tools/dark_medium_response_atlas_document_helpers.py",
      "tools/dark_medium_response_atlas_pdf_helpers.py",
      "tools/dark_medium_response_atlas_release.py",
      "tools/inspect_dark_medium_response_atlas_pdf.py",
      "tools/link_audit_common.py",
      "tools/render_dark_medium_response_atlas_pdf.py",
      "tools/verify.py"
    ],
    "identity_closure_paths": [
      "MANIFEST.sha256",
      "evidence/dark_medium_response_atlas_publication_successor_overlay_s2.json"
    ],
    "source_paths": [
      ".github/ISSUE_TEMPLATE/config.yml",
      ".github/workflows/pages.yml",
      ".github/workflows/release-dark-medium-response-atlas.yml",
      ".github/workflows/verify.yml",
      ".gitignore",
      "CHANGELOG.md",
      "CONTRIBUTING.md",
      "LICENSE_MAP.md",
      "PROVENANCE.md",
      "PUBLICATIONS.md",
      "README.md",
      "RELEASE_NOTES_earth-instrument-wp-0.1.md",
      "REPRODUCING.md",
      "docs/404.html",
      "docs/index.html",
      "docs/resources/index.html",
      "docs/style.css",
      "evidence/README.md",
      "evidence/dark_medium_response_atlas_successor_overlay_s1.json",
      "evidence/pages_admission_v1.json",
      "resources/README.md",
      "resources/dark-medium-response-atlas/draft-v0.1.0/CHANGE_LOG.md",
      "resources/dark-medium-response-atlas/draft-v0.1.0/DARK_MEDIUM_RESPONSE_ATLAS.md",
      "resources/dark-medium-response-atlas/draft-v0.1.0/LICENSE_MAP.md",
      "resources/dark-medium-response-atlas/draft-v0.1.0/README.md",
      "resources/dark-medium-response-atlas/draft-v0.1.0/claim_ledger.csv",
      "resources/dark-medium-response-atlas/draft-v0.1.0/draft_metadata.json",
      "resources/dark-medium-response-atlas/draft-v0.1.0/novelty_ledger.csv",
      "resources/dark-medium-response-atlas/draft-v0.1.0/source_ledger.csv",
      "resources/dark-medium-response-atlas/v0.1.0/CHANGELOG.md",
      "resources/dark-medium-response-atlas/v0.1.0/CITATION.cff",
      "resources/dark-medium-response-atlas/v0.1.0/LICENSE_MAP.md",
      "resources/dark-medium-response-atlas/v0.1.0/README.md",
      "resources/dark-medium-response-atlas/v0.1.0/RELEASE_NOTES.md",
      "resources/dark-medium-response-atlas/v0.1.0/RELEASE_SPEC.json",
      "resources/dark-medium-response-atlas/v0.1.0/claim-ledger.csv",
      "resources/dark-medium-response-atlas/v0.1.0/dark-medium-response-atlas-v0.1.0.css",
      "resources/dark-medium-response-atlas/v0.1.0/dark-medium-response-atlas-v0.1.0.html",
      "resources/dark-medium-response-atlas/v0.1.0/dark-medium-response-atlas-v0.1.0.md",
      "resources/dark-medium-response-atlas/v0.1.0/dark-medium-response-atlas-v0.1.0.pdf",
      "resources/dark-medium-response-atlas/v0.1.0/external-link-observations.json",
      "resources/dark-medium-response-atlas/v0.1.0/html-accessibility.json",
      "resources/dark-medium-response-atlas/v0.1.0/novelty-ledger.csv",
      "resources/dark-medium-response-atlas/v0.1.0/pdf-inspection.json",
      "resources/dark-medium-response-atlas/v0.1.0/publication-identity.json",
      "resources/dark-medium-response-atlas/v0.1.0/source-ledger.csv",
      "resources/dark-medium-response-atlas/v0.1.0/visual-review.json",
      "schemas/README.md",
      "schemas/dark-medium-response-atlas-html-accessibility-v1.schema.json",
      "schemas/dark-medium-response-atlas-pdf-inspection-v1.schema.json",
      "schemas/dark-medium-response-atlas-publication-identity-v1.schema.json",
      "schemas/dark-medium-response-atlas-publication-successor-overlay-s2.schema.json",
      "schemas/dark-medium-response-atlas-successor-overlay-s1.schema.json",
      "schemas/dark-medium-response-atlas-visual-review-v1.schema.json",
      "schemas/external-link-observations-v1.schema.json",
      "schemas/pages-admission-v1.schema.json",
      "schemas/supplemental-release-identity-v2.schema.json",
      "schemas/supplemental-release-spec-v2.schema.json",
      "tests/conftest.py",
      "tests/test_claim_source_coverage.py",
      "tests/test_dark_medium_response_atlas_documents.py",
      "tests/test_dark_medium_response_atlas_publication_successor_overlay_s2.py",
      "tests/test_dark_medium_response_atlas_release.py",
      "tests/test_dark_medium_response_atlas_successor_overlay.py",
      "tests/test_dark_medium_response_atlas_successor_overlay_historical.py",
      "tests/test_link_audits.py",
      "tests/test_pages_admission.py",
      "tests/test_pages_contract.py",
      "tools/assemble_pages.py",
      "tools/build_dark_medium_response_atlas_documents.py",
      "tools/build_dark_medium_response_atlas_publication_successor_overlay.py",
      "tools/build_dark_medium_response_atlas_successor_overlay.py",
      "tools/build_pages_admission.py",